{
  "year": 2026,
  "week": 1,
  "summary": {
    "days_analyzed": 0,
    "green_days": 0,
    "total_trades": 0,
    "wins": 0,
    "losses": 0,
    "win_rate_pct": 0,
    "total_pnl": 0
  },
  "best_day": null,
  "worst_day": null,
  "regime_performance": {},
  "top_gating_reasons": [],
  "common_patterns": [],
  "recommended_investigation": "No data available for analysis.",
  "daily_summaries": [],
  "generated_at": "2026-01-03T10:25:27.609601"
}